{
  "schema": 1,
  "name": "veshell",
  "version": "0.1.7",
  "prerelease": null,
  "channel": "beta",
  "date": "2026-10-20T21:50:23Z",
  "commit": "022539915144bed4f9275d9e8394c6df77543ef0",
  "maintainer": "Adrien Peslerbe <adrien@pesler.be>",
  "polkit_helper": "/usr/lib/polkit-1/polkit-agent-helper-1",
  "mirrors": {
    "source": "https://github.com/free-explorers/veshell/archive",
    "inputs": "https://github.com/free-explorers/veshell-packaging/releases/download/packaging-inputs-v0.1.7"
  },
  "flutter": {
    "version": "3.47.7",
    "channel": "stable",
    "engine_revision": "deb287481e3ce9468f3434937ced4240a70539ca",
    "sdk": {
      "url": "https://storage.googleapis.com/flutter_infra_release/releases/stable/linux/flutter_linux_3.47.7-stable.tar.xz",
      "sha256": "af7455f540df951184c7953fbe3cf884766e7541dacf8571f9f582db03dd6230"
    },
    "artifacts": {
      "patched_sdk": {
        "url": "https://storage.googleapis.com/flutter_infra_release/flutter/deb287481e3ce9468f3434937ced4240a70539ca/flutter_patched_sdk.zip",
        "sha256": "e80fa5e63f51751507627456294bef28419c4facd09c33f7f49a7b4d986846f3"
      },
      "patched_sdk_product": {
        "url": "https://storage.googleapis.com/flutter_infra_release/flutter/deb287481e3ce9468f3434937ced4240a70539ca/flutter_patched_sdk_product.zip",
        "sha256": "8b2ad98bd8c2f86e647da5c3863de0ffb34dc00887a005c8074971ebd76e4454"
      },
      "linux_x64_artifacts": {
        "url": "https://storage.googleapis.com/flutter_infra_release/flutter/deb287481e3ce9468f3434937ced4240a70539ca/linux-x64/artifacts.zip",
        "sha256": "1a716b779bc669def11c0ebac97d5400efa201824419fe67397802ffe5cdb756"
      },
      "linux_x64_debug_gtk": {
        "url": "https://storage.googleapis.com/flutter_infra_release/flutter/deb287481e3ce9468f3434937ced4240a70539ca/linux-x64-debug/linux-x64-flutter-gtk.zip",
        "sha256": "e1ed3d3ccc0d42d1dc58fa141dc83c4be511e5a2a1cbe0319c2aa8ae6afeadc4"
      },
      "linux_x64_profile_gtk": {
        "url": "https://storage.googleapis.com/flutter_infra_release/flutter/deb287481e3ce9468f3434937ced4240a70539ca/linux-x64-profile/linux-x64-flutter-gtk.zip",
        "sha256": "853bee7a69edf5931f02121086118bd8dbfe01d081192c6d6cae232b1abede47"
      },
      "linux_x64_release_gtk": {
        "url": "https://storage.googleapis.com/flutter_infra_release/flutter/deb287481e3ce9468f3434937ced4240a70539ca/linux-x64-release/linux-x64-flutter-gtk.zip",
        "sha256": "a6da7b0d57c82519d7b901462344676fe089068caca336466dcf3e1c270e9aa8"
      }
    },
    "engine": {
      "url": "https://github.com/free-explorers/flutter-engine/releases/download/linux-engine-sdk-release-x86_64-deb287481e3ce9468f3434937ced4240a70539ca/linux-engine-sdk-release-x86_64-deb287481e3ce9468f3434937ced4240a70539ca.tar.gz",
      "sha256": "7f111525f32a590d1f00526758f1fecb520424b98aecc6afac82d5014a1684c7"
    }
  },
  "nix": {
    "engine_source": {
      "repository": "free-explorers/flutter-engine-nix",
      "revision": "fc658766e461d659493618eff60bacb72d4ec212",
      "sha256": "0bvb7hvlgr5gim1svyfhgdh7yqkhgsdlfhyq4i3nml50gwj066cm"
    }
  },
  "inputs": {
    "cargo_vendor": {
      "sha256": "1c1863bdf68ca0f3cb6640b8f512f000ad3e1af034feef3a7603b34e654ad703"
    },
    "pubcache": {
      "sha256": "706214a8698f663a79bc8aba582a730ac8529ff3a76e596cdd95cd6934c2482b"
    }
  }
}
